GenAIElective,BSAI 473,Capstone in Artificial Intelligence,New,YES,"Students will be paired with project advisors from the UMD faculty or alternatively, an industry advisor. Students are encouraged to plan for projects results that can be published at academic conferences or will impact academic research.
Semester-long project course in which each student will identify and carry out a project related to machine learning, with the goal of publishing a research paper or software tool.",,,,,,,,,,,,
SocietyElective,BSAI 473,Capstone in Artificial Intelligence,New,YES,"Students will be paired with project advisors from the UMD faculty or alternatively, an industry advisor. Students are encouraged to plan for projects results that can be published at academic conferences or will impact academic research.
Semester-long project course in which each student will identify and carry out a project related to machine learning, with the goal of publishing a research paper or software tool.",,,,,,,,,,,,
,,,,,,,,,,,,,,,,,
,,,,,,,,,,,,,,,,,
,,,,,,,,,,,,,,,,,
,,,,,,,,,,,,,,,,,
SocietyRequired,GEOG 398E,Special Topics in Geography; Introduction to Spatial Artificial Intelligence,Existing,YES,"An introductory course to spatial artificial intelligence (AI), providing a big picture of spatial AI applications (e.g., Google Maps, Uber/Lyft, Earth observation, smart cities, autonomous vehicles), techniques, platforms, trends, debates, etc. The course will cover basics of AI, identify challenges faced by AI techniques in the context of spatial data and applications, and introduce spatial-aware AI methods to address them. AI topics include but are not limited to: spatial data models and knowledge representation, pattern mining, machine learning, perception, planning, etc. Students are expected to have a broad understanding of spatial A concepts, develop intuitions and insights to AI techniques, and have some hands-on experience (Python) at the end of the course.",,,1,GEOG,3,EXT,0.2,,,,,GEOG_EXT_Existing_3
SocietyRequired,BSAI 460,AI and Life of Great Cities ,New,YES,"""AI, Data Science and Cities"" explores the transformative role of artificial intelligence
and data science in shaping urban environments, from smart infrastructure to
data-driven policymaking. Students will learn how to develop and apply AI algorithms
and data science pipelines to enhance mobility, sustainability, and governance while
also considering ethical, social, and equity challenges. Through case studies, hands-on
projects, and interdisciplinary discussions, the course equips students with the technical
and analytical skills needed to design AI- and data-driven urban solutions. By the end,
students will critically assess the potential and limitations of AI and Data Science in
building more resilient, inclusive, and intelligent cities.",,,1,INFO,3,EXT,0.2,,,,,INFO_EXT_New_3
SocietyElectives,BSAI 491,AI Clinic,New,YES,"The AI clinic aims to become the go-to resource for assisting local Maryland
governments and small organizations in their procurement processes for AI tools. The
idea behind the AI Clinic is inspired by legal clinics present across many law schools in
the US as well as by the Clinic to End Tech Abuse (CETA) at Cornell Tech. The AI Clinic
will provide services to local government agencies and small organizations that do not
have the expertise or resources to carry out the evaluation of AI tools that they are
considering using to support their decision-making processes.
The AI Clinic will take on “AI cases” that will be led by one faculty member and by a
group of four students with diverse educational backgrounds. AI cases will provide
semester-long, hands-on learning opportunities for students and will prepare them for
the challenges of AI deployment in real-world settings. The output of the AI cases might
include reports with tool assessments (technical and community-centric) that will be
shared with the agency or organization that requested the case, toolkits for decision
makers on how to carry out their own AI evaluations, or training sessions for decision
makers and small organizations on how to use different types of AI tools, among others.","(Katie Shilton and I will be piloting this sometime in 2026. Funded via the
Values-Centered AI initiative, UMD Grand Challenges. This could easily be an
INST 4XX, but if there is interest, it could be made an AI course and potentially
share it with the BA in AI)",,,,,,0.01875,,,,,
SocietyRequired,INST 366,"Privacy, Security and Ethics for Big Data",Existing,YES,,,,1,INFO,3,EXT,0.2,,,,,INFO_EXT_Existing_3
SocietyElectives,CMSC 474,Introduction to Computational Game Theory,Existing,,,,,,,,,,,,,,
SocietyRequired,CMSC401,Algorithms for Geospatial Computing,Existing,YES,,,,1,CS,3,TTK,0.2,,,,,CS_TTK_Existing_3
SocietyRequired,WGSS115,"Gender, Race, and Computing",Existing,YES,,,,1,WGSS,3,EXT,0.2,,,,,WGSS_EXT_Existing_3
SocietyElectives,SOCY105,Understanding Contemporary Social Problems - Frameworks for Critical Thinking and Strategies for Solutions,Existing,YES,,,,,,,,,,,,,
SocietyElectives,AMST260,American Culture in the Information Age,Existing,,,,,,,,,,,,,,
SocietyElectives,AASP 441,"Science, Technology, and the Black Community",Existing,,,," HIST255, AASP202, or AASP100; or permission of BSOS-African American Studies department.",,,,,,,,,,
SocietyElectives,PLCY201,Public Leaders and Active Citizens,Existing,,,,,,,,,0.01875,,,,,
SocietyElectives,PLCY215,Innovation and Social Change: Creating Change for Good,Existing,,,,,,,,,0.01875,,,,,
SocietyElectives,PLCY240,"Ethical, Policy and Social Implications for Science and Technology",Existing,,,,,,,,,0.01875,,,,,
,,,,,,,,,,,,,,,,,
,,,,,,,,,,,,,,,,,
RoboticsElectives,ENME  444,Assistive Robotics,Existing,,,,,,,,,0.03,,,,,
,,,,,,,,,,,,,,,,,
RoboticsRequired,ENME 480,Introduction to Robotics,Existing,YES,"This course is an introductory course to the robotics minor and educates students in the elementary concepts of robotics. The topics covered in the course include mathematics of rigid motion, rotations, translations, homogeneous transformations, forward kinematics, inverse kinematics, velocity kinematics, geometric Jacobian, analytical Jacobian, motion planning, trajectory generation, independent joint control, linear control methods such as PD, PID, actuator dynamics, feedforward control for trajectory tracking, force control, basic computer vision concepts including thresholding, image segmentation, and camera calibration. This course also includes a laboratory component to be conducted in the Robot Realization Laboratory in the Engineering Annex Building.",Should allow 142 as prereq,,1,ENG,3,EXT,0.2,,,,,ENG_EXT_Existing_3
RoboticsRequired,ENAE 450,Robotics Programming,Existing,YES,"This practical robotics class teaches practical skills to build, control, and deploy robotic systems. Interdisciplinary groups of students develop real-world robotic systems. The first 10 weeks of the lab are devoted to 5 pre-programmed experiments. The remainder of the lab is devoted to student projects. Students work in teams of 2, preferably with each student coming from a different background in engineering. There are 2 weekly lectures. The emphasis of the class is entirely on making a real robot do what you want it to do. In the first experiment, students perform a simple servomechanism experiment, where students control a single joint of a robot. We vary the weight on the movable rod to simulate the effects of the changing inertia due to outer segments moving. Next, we have the students directly control several joints of a robot arm. The third experiment is to control the position and orientation of the end effector. A fourth experiment deals with grasping. A fifth experiment deals with the position and orientation of a wheeled robot. ",,,1,ENG,3,EXT,0.2,,,,,ENG_EXT_Existing_3
RoboticsRequired,CMSC 477,Robotics Perception and Planning,Existing,YES,"This course teaches the fundamentals of robot perception and robot path planning. The syllabus and course is divided into two segments, as per the major aspects involved in robotics. There will be lectures on (a) planning and control and (b) perception, with projects and homework. The syllabus includes the following: Motion Planning Introduction, Rigid Body Transformations, Velocity, Velocity Dynamics, Vehicle Controls, Graph Based Planning, Sampling Based Planning, Trajectory Planning, Navigation, Baeyesian and Kalman Filtering, Camera Model and Calibration, Projective Geometry, Visual Perception features, Optical Flow, Pose Estimation, 3D Velocities, Basics of Machine Learning, Structure from Motion, Visual Odometry, and Recognition and Learning. There are two examinations, 3 projects in multiple phases, and two homeworks. The class uses robots, mobile platforms with sensors and effectors. Drone experiments are done in simulation or in the Iribe Drone Lab, space permitting.",,,1,CS,3,TTK,0.2,,,,,CS_TTK_Existing_3
RoboticsRequired,ENEE 467,Robotics Project Laboratory,Existing,YES,"This practical robotics class teaches practical skills to build, control, and deploy robotic systems. Interdisciplinary groups of students develop real-world robotic systems. The first 10 weeks of the lab are devoted to 5 pre-programmed experiments. The remainder of the lab is devoted to student projects. Students work in teams of 2, preferably with each student coming from a different background in engineering. There are 2 weekly lectures. The emphasis of the class is entirely on making a real robot do what you want it to do. In the first experiment, students perform a simple servomechanism experiment, where students control a single joint of a robot. We vary the weight on the movable rod to simulate the effects of the changing inertia due to outer segments moving. Next, we have the students directly control several joints of a robot arm. The third experiment is to control the position and orientation of the end effector. A fourth experiment deals with grasping. A fifth experiment deals with the position and orientation of a wheeled robot. ",,,1,ENG,3,EXT,0.2,,,,,ENG_EXT_Existing_3
RoboticsRequired,BSAI 461,Multiagent Systems,New,YES,"A course on the theory and practice of AI agents interacting in the wild: how to ensure security, how communication protocols can emerge, and how to measure consensus.",,,1,CS,3,TTK,0.2,,,,,CS_TTK_New_3
,,,,,,,,,,,,,,,,,
,,,,,,,,,,,,,,,,,
RoboticsElectives,CMSC 422,Intro to Machine Learning,Existing,YES,TEMP,,,,,,,,,,,,
RoboticsElectives,CMSC 426,Image Processing,Existing,YES,TEMP,,,,,,,,,,,,
RoboticsElectives,CMSC498E,Selected Topics in Computer Science; Robotics,Existing,YES,TEMP,,,,,,,,,,,,
,,,,,,,,,,,,,,,,,
RoboticsElectives,BSAI 427,Reinforcement Learning,New,YES,TEMP,,,,,,,,,,,,
,,,,,,,,,,,,,,,,,
,,,,,,,,,,,,,,,,,
AlgorithmsRequired,BSAI 461,Multiagent Systems,New,YES,"A course on the theory and practice of AI agents interacting in the wild: how to ensure security, how communication protocols can emerge, and how to measure consensus.",,,1,CS,3,TTK,0.2,,,,,CS_TTK_New_3
AlgorithmsRequired,BSAI 427,Reinforcement Learning,New,YES,TEMP,,,1,CS,3,TTK,0.2,,,,,CS_TTK_New_3
AlgorithmsRequired,CMSC 472,Introduction to Deep Learning,Existing,YES,TEMP,,,1,CS,3,TTK,0.2,,,,,CS_TTK_Existing_3
AlgorithmsRequired,CMSC 422,Introduction to Machine Learning,Existing,YES,TEMP,,,1,CS,3,TTK,0.2,,,,,CS_TTK_Existing_3
,,,,,,,,,,,,,,,,,
,,,,,,,,,,,,,,,,,
AlgorithmsElectives,BSAI 429,Multimodal Generation,New,YES,TEMP,,,1,CS,4,TTK,0.04285714286,,,,,CS_TTK_New_4
AlgorithmsElectives,CMSC 426,Computer Vision,Existing,YES,TEMP,,,,,,,,,,,,
AlgorithmsElectives,CMSC 470,Natural Language Processing,Existing,YES,TEMP,,,,,,,,,,,,
AlgorithmsElectives,CMSC 477,Robotics Perception and Planning,Existing,YES,TEMP,,,,,,,,,,,,
AlgorithmsElectives,CMSC 401,Algorithms for Geospatial Computing,Existing,YES,TEMP,,,,,,,,,,,,
AlgorithmsElectives,CMSC 454,Algorithms for Data Science,Existing,YES,TEMP,,,,,,,,,,,,
AlgorithmsElectives,CMSC 426,Image Processing,Existing,YES,TEMP,,,,,,,,,,,,
,,,,,,,,,,,,,,,,,
AccessibleRequired,WGSS 105,Introduction to Disability Studies,Existing,YES,,,,,,,,,,,,,
AccessibleRequired,CMSC 434,Introduction to Human-Computer Interaction,Existing,YES,,,,,,,,,,,,,
AccessibleRequired,INST 401 ,Design and Human Disability and Aging,Refocus,YES,,"Would be good to also have CS HCI as possible prereq.  This hasn't been taught in a while, so we might want to propose a new AIM hire to take over teaching.",,1,INFO,3,EXT,0.2,,,,,INFO_EXT_New_3
,,,,,,,,,,,,,,,,,
AccessibleElectives,INST 402,Designing Patient-Centered Technologies,Existing,YES,,,,,,,,,,,,,
AccessibleElectives,CMSC 471,Intro to Data Visualization,Existing,,,,,,,,,,,,,,
AccessibleElectives,CMSC 436,Programming Handheld Systems,Existing,YES,,,,,,,,,,,,,
AccessibleElectives,CMSC 470,Introduction to Natural Language Processing,Existing,,,,,,,,,,,,,,
AccessibleElectives,INST 362,User-Centered Design,Existing,YES,,,,,,,,,,,,,
AccessibleElectives,AMST 320,(Dis)ability in American Film,Existing,,,,,,,,,,,,,,